{
  "schema_version": "1.1",
  "review_id": "hs_review:hs_pytorch_torch.nn.functional.cosine_embedding_loss_bug_aware_static:r4:rr1",
  "review_revision": 1,
  "parent_review_ref": null,
  "subject": {
    "spec_id": "hs_pytorch_torch.nn.functional.cosine_embedding_loss_bug_aware_static",
    "revision_number": 4,
    "content_hash": "95756ac5c476d86479bfd4d5bcf85975b5fc2ee52705378c3cdffdfed1ca9d09",
    "relative_path": "experiment/EXP011_bug_aware_harness_synthesis/harness_specs/pytorch/torch.nn.functional.cosine_embedding_loss/bug_aware_static/hs_pytorch_torch.nn.functional.cosine_embedding_loss_bug_aware_static_r4.json"
  },
  "rules_ref": {
    "artifact_id": "harness_spec_human_review_rules__v1.3__sha256_469418fea7ac324a909e4f8da8d4fd94f4de59ae1bfe006b8046bf8d29584251.md",
    "artifact_version": "1.3",
    "content_hash": "469418fea7ac324a909e4f8da8d4fd94f4de59ae1bfe006b8046bf8d29584251",
    "relative_path": "experiment/EXP011_bug_aware_harness_synthesis/harness_spec_review_artifacts/harness_spec_human_review_rules__v1.3__sha256_469418fea7ac324a909e4f8da8d4fd94f4de59ae1bfe006b8046bf8d29584251.md"
  },
  "decision": "approved",
  "findings": [],
  "reviewer_id": "nathan",
  "reviewed_at": "2026-10-06T01:12:49.086722Z",
  "review_notes": null
}
