{
  "schema_version": "1.1",
  "review_id": "hs_review:hs_pytorch_torch.nn.functional.cosine_embedding_loss_bug_aware_static:r3:rr1",
  "review_revision": 1,
  "parent_review_ref": null,
  "subject": {
    "spec_id": "hs_pytorch_torch.nn.functional.cosine_embedding_loss_bug_aware_static",
    "revision_number": 3,
    "content_hash": "e02c898ea1bb7077b377a905bf3ed5b0ba3323471bca7f07d058e6993cf2c703",
    "relative_path": "experiment/EXP011_bug_aware_harness_synthesis/harness_specs/pytorch/torch.nn.functional.cosine_embedding_loss/bug_aware_static/hs_pytorch_torch.nn.functional.cosine_embedding_loss_bug_aware_static_r3.json"
  },
  "rules_ref": {
    "artifact_id": "harness_spec_human_review_rules__v1.3__sha256_469418fea7ac324a909e4f8da8d4fd94f4de59ae1bfe006b8046bf8d29584251.md",
    "artifact_version": "1.3",
    "content_hash": "469418fea7ac324a909e4f8da8d4fd94f4de59ae1bfe006b8046bf8d29584251",
    "relative_path": "experiment/EXP011_bug_aware_harness_synthesis/harness_spec_review_artifacts/harness_spec_human_review_rules__v1.3__sha256_469418fea7ac324a909e4f8da8d4fd94f4de59ae1bfe006b8046bf8d29584251.md"
  },
  "decision": "needs_revision",
  "findings": [
    {
      "criterion_id": "HR-04",
      "severity": "blocking",
      "field_path": "$.knowledge_plan.knowledge_decisions[0].component_mappings[4]",
      "evidence_ref": "knowledge:kn_pt_pv4_cosine_embedding_loss_mismatched_dimension_validation_boundary_k001#/exploration_guidance/variation_opportunities/1",
      "mismatch_summary": "The mapping defers the complete component although the cited source contains an expressible empty-input sub-scope. The branch goal claims empty and near-empty exploration, but its only structured target condition covers shape mismatch. The supported empty sub-scope must be represented while the qualitative small non-empty range remains deferred because no threshold is supported."
    }
  ],
  "reviewer_id": "nathan",
  "reviewed_at": "2026-10-05T08:57:46.547089Z",
  "review_notes": null
}
